[
  {
    "id": "saga-of-the-beastslayer",
    "name": "Saga of the Beastslayer",
    "faction_id": "space-wolves",
    "detachment_rule_id": null,
    "enhancement_ids": [
      "wolf-touched",
      "hunters-guile",
      "elders-guidance",
      "helm-of-the-beastslayer"
    ],
    "stratagem_ids": [
      "unbridled-ferocity",
      "shock-cavalry",
      "pinning-fire",
      "thunderous-pursuit",
      "impetuosity",
      "coordinated-strike"
    ],
    "game_version": {
      "edition": "11th",
      "dataslate": "pre-launch-provisional"
    },
    "detachment_points": 2,
    "force_dispositions": [
      "purge-the-foe"
    ]
  },
  {
    "id": "champions-of-fenris",
    "name": "Champions of Fenris",
    "faction_id": "space-wolves",
    "detachment_rule_id": null,
    "enhancement_ids": [
      "a-giant-amongst-giants",
      "preyslayer"
    ],
    "stratagem_ids": [
      "wolf-totems",
      "runes-of-claiming",
      "stalk-between-worlds"
    ],
    "game_version": {
      "edition": "11th",
      "dataslate": "pre-launch-provisional"
    },
    "detachment_points": 1,
    "force_dispositions": []
  },
  {
    "id": "saga-of-the-hunter",
    "name": "Saga of the Hunter",
    "faction_id": "space-wolves",
    "detachment_rule_id": null,
    "enhancement_ids": [
      "swift-hunter",
      "fenrisian-grit",
      "wolf-master",
      "feral-rage"
    ],
    "stratagem_ids": [
      "overwhelming-onslaught",
      "marked-for-destruction",
      "envelop-and-ensnare",
      "territorial-advantage",
      "chosen-prey",
      "bounding-advance"
    ],
    "game_version": {
      "edition": "11th",
      "dataslate": "pre-launch-provisional"
    },
    "detachment_points": 2,
    "force_dispositions": []
  },
  {
    "id": "saga-of-the-great-wolf",
    "name": "Saga of the Great Wolf",
    "faction_id": "space-wolves",
    "detachment_rule_id": null,
    "enhancement_ids": [
      "grimnars-mark",
      "howling-onslaught",
      "howlmaw",
      "chariots-of-the-storm",
      "skjalds-foretelling"
    ],
    "stratagem_ids": [
      "the-foe-foreseen",
      "unrelenting-hunters",
      "grimnars-command",
      "eye-of-the-pack",
      "battle-instincts",
      "fenrisian-ferocity"
    ],
    "game_version": {
      "edition": "11th",
      "dataslate": "pre-launch-provisional"
    },
    "detachment_points": 2,
    "force_dispositions": [
      "take-and-hold"
    ]
  },
  {
    "id": "saga-of-the-bold",
    "name": "Saga of the Bold",
    "faction_id": "space-wolves",
    "detachment_rule_id": null,
    "enhancement_ids": [
      "braggarts-steel",
      "skjald",
      "hordeslayer",
      "thunderwolfs-fortitude"
    ],
    "stratagem_ids": [
      "inspiring-presence",
      "champions-guidance",
      "birth-of-a-saga",
      "alpha-strike",
      "heroic-resolve",
      "countercharge"
    ],
    "game_version": {
      "edition": "11th",
      "dataslate": "pre-launch-provisional"
    },
    "detachment_points": 2,
    "force_dispositions": []
  },
  {
    "id": "legends-of-saga-and-song",
    "name": "Legends of Saga and Song",
    "faction_id": "space-wolves",
    "detachment_rule_id": null,
    "enhancement_ids": [
      "thirst-for-glory",
      "fierce-example"
    ],
    "stratagem_ids": [
      "fangs-of-the-pack",
      "chilling-howl",
      "wings-of-the-blizzard"
    ],
    "game_version": {
      "edition": "11th",
      "dataslate": "pre-launch-provisional"
    },
    "detachment_points": 1,
    "force_dispositions": [
      "take-and-hold"
    ]
  },
  {
    "id": "veterans-of-the-fang",
    "name": "Veterans of the Fang",
    "faction_id": "space-wolves",
    "detachment_rule_id": null,
    "enhancement_ids": [
      "eye-of-the-hunter",
      "weaver-of-sagas"
    ],
    "stratagem_ids": [
      "grizzled-killers",
      "icy-calm",
      "blade-keen-senses"
    ],
    "game_version": {
      "edition": "11th",
      "dataslate": "pre-launch-provisional"
    },
    "detachment_points": 1,
    "force_dispositions": [
      "disruption"
    ]
  }
]
