[
  {
    "id": "blade-of-ultramar",
    "name": "Blade of Ultramar",
    "faction_id": "ultramarines",
    "detachment_rule_id": null,
    "enhancement_ids": [
      "armour-of-antoninus",
      "oath-of-macragge",
      "student-of-the-codex",
      "veteran-of-behemoth"
    ],
    "stratagem_ids": [
      "armour-of-contempt",
      "ultramarian-adaptivity",
      "exemplary-vigilance",
      "tactical-foresight",
      "practical-tactics",
      "courage-and-honour"
    ],
    "game_version": {
      "edition": "11th",
      "dataslate": "pre-launch-provisional"
    },
    "detachment_points": 3,
    "force_dispositions": [
      "priority-assets"
    ]
  }
]
