[
  {
    "id": "valourstrike-lance",
    "name": "Valourstrike Lance",
    "faction_id": "imperial-knights",
    "detachment_rule_id": null,
    "enhancement_ids": [
      "bearer-of-the-iron-chalice",
      "bearer-of-the-evanescent-ion",
      "bearer-of-the-judicants-helm",
      "bearer-of-the-lancers-sigil"
    ],
    "stratagem_ids": [
      "thunderstomp",
      "full-tilt",
      "run-them-through",
      "vow-of-retribution",
      "tactical-foil",
      "rotate-ion-shields"
    ],
    "game_version": {
      "edition": "11th",
      "dataslate": "pre-launch-provisional"
    },
    "detachment_points": 2,
    "force_dispositions": [
      "purge-the-foe"
    ]
  },
  {
    "id": "questor-forgepact",
    "name": "Questor Forgepact",
    "faction_id": "imperial-knights",
    "detachment_rule_id": null,
    "enhancement_ids": [
      "omnissian-champion",
      "knight-of-the-opus-machina",
      "magos-questoris",
      "vocifer-magnificat-aura"
    ],
    "stratagem_ids": [
      "bonded-imperative",
      "machine-focus",
      "aggression-begets-aggression",
      "thronegheist-fury",
      "omnissiahs-grace",
      "vengeance-of-the-machine-cult"
    ],
    "game_version": {
      "edition": "11th",
      "dataslate": "pre-launch-provisional"
    },
    "detachment_points": 1,
    "force_dispositions": [
      "disruption"
    ]
  },
  {
    "id": "gate-warden-lance",
    "name": "Gate Warden Lance",
    "faction_id": "imperial-knights",
    "detachment_rule_id": null,
    "enhancement_ids": [
      "acquisitor-at-arms",
      "purgations-hand",
      "augury-halo",
      "vengeful-tread"
    ],
    "stratagem_ids": [
      "drive-them-out",
      "steadfast-superiority",
      "marshal-the-defence",
      "titanic-bombardment",
      "fortress-of-intimidation",
      "lancebreaker"
    ],
    "game_version": {
      "edition": "11th",
      "dataslate": "pre-launch-provisional"
    },
    "detachment_points": 2,
    "force_dispositions": [
      "priority-assets"
    ]
  },
  {
    "id": "spearhead-at-arms",
    "name": "Spearhead-at-Arms",
    "faction_id": "imperial-knights",
    "detachment_rule_id": null,
    "enhancement_ids": [
      "mentors-pride",
      "fables-of-nightmare",
      "tales-of-heroism",
      "martial-tuition"
    ],
    "stratagem_ids": [
      "virtue-of-courage",
      "exemplars-wisdom",
      "thin-their-ranks",
      "let-duty-be-your-shield",
      "mantle-of-the-mentor",
      "squires-of-the-hunt"
    ],
    "game_version": {
      "edition": "11th",
      "dataslate": "pre-launch-provisional"
    },
    "detachment_points": 2,
    "force_dispositions": [
      "reconnaissance"
    ]
  },
  {
    "id": "questoris-companions",
    "name": "Questoris Companions",
    "faction_id": "imperial-knights",
    "detachment_rule_id": null,
    "enhancement_ids": [
      "herald-of-triumph",
      "wyrmslayer-divination",
      "pennant-of-silvered-fury",
      "crushing-condemnation"
    ],
    "stratagem_ids": [
      "courageous-stand",
      "titanic-duel",
      "moment-of-glory",
      "heros-tread",
      "driven-by-the-past",
      "unstoppable-warrior"
    ],
    "game_version": {
      "edition": "11th",
      "dataslate": "pre-launch-provisional"
    },
    "detachment_points": 3,
    "force_dispositions": [
      "take-and-hold"
    ]
  },
  {
    "id": "dominus-foebreakers",
    "name": "Dominus Foebreakers",
    "faction_id": "imperial-knights",
    "detachment_rule_id": "rain-of-devastation",
    "enhancement_ids": [
      "blessed-plate",
      "archeotech-autoloaders"
    ],
    "stratagem_ids": [
      "ground-shaking-strides",
      "foebreaker-firestorm",
      "fire-shocked"
    ],
    "game_version": {
      "edition": "11th",
      "dataslate": "pre-launch-provisional"
    },
    "detachment_points": 1,
    "force_dispositions": [
      "purge-the-foe"
    ]
  },
  {
    "id": "throne-bonded-outriders",
    "name": "Throne-bonded Outriders",
    "faction_id": "imperial-knights",
    "detachment_rule_id": "driven-from-their-lairs",
    "enhancement_ids": [
      "gyro-optimised-actuators",
      "ancestral-overbleed"
    ],
    "stratagem_ids": [
      "neural-lash",
      "helm-conditioning",
      "honoured-to-serve"
    ],
    "game_version": {
      "edition": "11th",
      "dataslate": "pre-launch-provisional"
    },
    "detachment_points": 1,
    "force_dispositions": [
      "reconnaissance"
    ],
    "tags": [
      "armigers"
    ]
  },
  {
    "id": "freeblade-company",
    "name": "Freeblade Company",
    "faction_id": "imperial-knights",
    "detachment_rule_id": "knights-of-legend",
    "enhancement_ids": [
      "mysterious-guardian",
      "sanctuary",
      "bringer-of-justice",
      "hunters-eye"
    ],
    "stratagem_ids": [
      "noble-sacrifice",
      "point-blank-barrage-freeblade",
      "strength-from-exile",
      "survivor-of-strife",
      "full-tilt-freeblade",
      "flanking-manoeuvres"
    ],
    "game_version": {
      "edition": "11th",
      "dataslate": "pre-launch-provisional"
    },
    "detachment_points": 3,
    "force_dispositions": [
      "purge-the-foe"
    ]
  }
]
