[
  {
    "id": "virulent-vectorium",
    "name": "Virulent Vectorium",
    "faction_id": "death-guard",
    "detachment_rule_id": null,
    "enhancement_ids": [
      "daemon-weapon-of-nurgle",
      "furnace-of-plagues",
      "arch-contaminator",
      "revolting-regeneration"
    ],
    "stratagem_ids": [
      "disgustingly-resilient",
      "leechspore-eruption",
      "plaguesurge",
      "putrid-detonation",
      "overwhelming-generosity",
      "creeping-blight"
    ],
    "game_version": {
      "edition": "11th",
      "dataslate": "pre-launch-provisional"
    },
    "detachment_points": 3,
    "force_dispositions": ["take-and-hold"]
  },
  {
    "id": "flyblown-host",
    "name": "Flyblown Host",
    "faction_id": "death-guard",
    "detachment_rule_id": null,
    "enhancement_ids": [
      "droning-chorus",
      "insectile-murmuration",
      "rejuvenating-swarm",
      "plagueveil"
    ],
    "stratagem_ids": [
      "droning-horror",
      "myphitic-invigoration",
      "vermin-cloud",
      "enervating-onslaught",
      "nauseating-paroxysms",
      "eye-of-the-swarm"
    ],
    "game_version": {
      "edition": "11th",
      "dataslate": "pre-launch-provisional"
    },
    "detachment_points": null,
    "force_dispositions": []
  },
  {
    "id": "tallyband-summoners",
    "name": "Tallyband Summoners",
    "faction_id": "death-guard",
    "detachment_rule_id": null,
    "enhancement_ids": [
      "beckoning-blight",
      "fell-harvester",
      "entropic-knell",
      "tome-of-bounteous-blessings"
    ],
    "stratagem_ids": [
      "clutching-corruption",
      "persistent-pests",
      "all-is-rot",
      "fleshy-avalanche",
      "avatars-of-decay",
      "mireslick"
    ],
    "game_version": {
      "edition": "11th",
      "dataslate": "pre-launch-provisional"
    },
    "detachment_points": null,
    "force_dispositions": []
  },
  {
    "id": "champions-of-contagion",
    "name": "Champions of Contagion",
    "faction_id": "death-guard",
    "detachment_rule_id": null,
    "enhancement_ids": [
      "final-ingredient",
      "visions-of-virulence",
      "needle-of-nurgle",
      "cornucophagus"
    ],
    "stratagem_ids": [
      "blessings-of-filth",
      "grotesque-fortitude",
      "malignance-magnified",
      "rabid-infusion",
      "mobile-vector",
      "deaths-heads"
    ],
    "game_version": {
      "edition": "11th",
      "dataslate": "pre-launch-provisional"
    },
    "detachment_points": null,
    "force_dispositions": []
  },
  {
    "id": "mortarions-hammer",
    "name": "Mortarion’s Hammer",
    "faction_id": "death-guard",
    "detachment_rule_id": null,
    "enhancement_ids": [
      "eye-of-affliction",
      "bilemaw-blight",
      "shriekworm-familiar",
      "tendrilous-emissions"
    ],
    "stratagem_ids": [
      "drawn-to-despair",
      "font-of-filth",
      "eyestinger-storm",
      "stinking-mire",
      "relentless-grind",
      "blighted-land"
    ],
    "game_version": {
      "edition": "11th",
      "dataslate": "pre-launch-provisional"
    },
    "detachment_points": null,
    "force_dispositions": []
  },
  {
    "id": "shamblerot-vectorium",
    "name": "Shamblerot Vectorium",
    "faction_id": "death-guard",
    "detachment_rule_id": null,
    "enhancement_ids": [
      "witherbone-pipes",
      "lord-of-the-walking-pox",
      "sorrowsyphon",
      "talisman-of-burgeoning"
    ],
    "stratagem_ids": [
      "gnawing-hunger",
      "grip-of-the-walking-pox",
      "smeared-with-filth",
      "hidden-amongst-the-dead",
      "shock-and-horror",
      "shambling-wall"
    ],
    "game_version": {
      "edition": "11th",
      "dataslate": "pre-launch-provisional"
    },
    "detachment_points": null,
    "force_dispositions": []
  },
  {
    "id": "death-lords-chosen",
    "name": "Death Lord’s Chosen",
    "faction_id": "death-guard",
    "detachment_rule_id": null,
    "enhancement_ids": [
      "face-of-death",
      "vile-vigour",
      "warprot-talisman",
      "helm-of-the-fly-king"
    ],
    "stratagem_ids": [
      "grim-reapers",
      "blooming-pestilence",
      "signal-pox",
      "undying-spite",
      "mortarions-teachings",
      "sickening-impact"
    ],
    "game_version": {
      "edition": "11th",
      "dataslate": "pre-launch-provisional"
    },
    "detachment_points": null,
    "force_dispositions": []
  }
]
