[
  {
    "id": "penitent-host",
    "name": "Penitent Host",
    "faction_id": "adepta-sororitas",
    "detachment_rule_id": null,
    "enhancement_ids": [
      "psalm-of-righteous-judgement",
      "verse-of-holy-piety",
      "refrain-of-enduring-faith",
      "catechism-of-divine-penitence"
    ],
    "stratagem_ids": [
      "passion-of-the-penitent",
      "lash-of-guilt",
      "purity-of-suffering",
      "final-redemption",
      "boundless-zeal",
      "devout-fanaticism"
    ],
    "game_version": {
      "edition": "11th",
      "dataslate": "pre-launch-provisional"
    },
    "detachment_points": 2,
    "force_dispositions": [
      "take-and-hold"
    ]
  },
  {
    "id": "hallowed-martyrs",
    "name": "Hallowed Martyrs",
    "faction_id": "adepta-sororitas",
    "detachment_rule_id": null,
    "enhancement_ids": [
      "saintly-example",
      "through-suffering-strength",
      "chaplet-of-sacrifice",
      "mantle-of-ophelia"
    ],
    "stratagem_ids": [
      "righteous-vengeance",
      "divine-intervention",
      "suffering-and-sacrifice",
      "sanctified-immolation",
      "praise-the-fallen",
      "spirit-of-the-martyr"
    ],
    "game_version": {
      "edition": "11th",
      "dataslate": "pre-launch-provisional"
    },
    "detachment_points": 3,
    "force_dispositions": [
      "priority-assets"
    ]
  },
  {
    "id": "bringers-of-flame",
    "name": "Bringers of Flame",
    "faction_id": "adepta-sororitas",
    "detachment_rule_id": null,
    "enhancement_ids": [
      "righteous-rage",
      "manual-of-saint-griselda",
      "fire-and-fury",
      "iron-surplice-of-saint-istalela"
    ],
    "stratagem_ids": [
      "shield-of-aversion",
      "righteous-blows",
      "rites-of-fire",
      "cleansing-flames",
      "blazing-ire",
      "carry-forth-the-faithful"
    ],
    "game_version": {
      "edition": "11th",
      "dataslate": "pre-launch-provisional"
    },
    "detachment_points": 3,
    "force_dispositions": [
      "purge-the-foe"
    ]
  },
  {
    "id": "champions-of-faith",
    "name": "Champions of Faith",
    "faction_id": "adepta-sororitas",
    "detachment_rule_id": null,
    "enhancement_ids": [
      "triptych-of-judgement",
      "mark-of-devotion",
      "eyes-of-the-oracle",
      "sanctified-amulet"
    ],
    "stratagem_ids": [
      "shield-of-denial",
      "to-the-heart-of-heresy",
      "path-of-the-righteous",
      "bastion-of-faith",
      "suffer-not-the-unfaithful",
      "indefatigable-dedication"
    ],
    "game_version": {
      "edition": "11th",
      "dataslate": "pre-launch-provisional"
    },
    "detachment_points": 2,
    "force_dispositions": [
      "disruption"
    ]
  },
  {
    "id": "army-of-faith",
    "name": "Army of Faith",
    "faction_id": "adepta-sororitas",
    "detachment_rule_id": null,
    "enhancement_ids": [
      "litanies-of-faith",
      "blade-of-saint-ellynor",
      "divine-aspect",
      "triptych-of-the-macharian-crusade"
    ],
    "stratagem_ids": [
      "shield-of-faith",
      "light-of-the-emperor",
      "faith-and-fury",
      "divine-guidance",
      "blinding-radiance",
      "angelic-descent"
    ],
    "game_version": {
      "edition": "11th",
      "dataslate": "pre-launch-provisional"
    },
    "detachment_points": 2,
    "force_dispositions": [
      "take-and-hold"
    ]
  },
  {
    "id": "chorus-of-condemnation",
    "name": "Chorus of Condemnation",
    "faction_id": "adepta-sororitas",
    "detachment_rule_id": "angelic-judgement",
    "enhancement_ids": [
      "clarion-of-urgency",
      "symphonic-payload"
    ],
    "stratagem_ids": [
      "inspirational-battle-cantics",
      "harmonised-exorcism",
      "devastating-reprise"
    ],
    "game_version": {
      "edition": "11th",
      "dataslate": "pre-launch-provisional"
    },
    "detachment_points": 1,
    "force_dispositions": [
      "reconnaissance"
    ],
    "tags": [
      "reverend"
    ]
  },
  {
    "id": "sacred-champions",
    "name": "Sacred Champions",
    "faction_id": "adepta-sororitas",
    "detachment_rule_id": "holy-quest",
    "enhancement_ids": [
      "writ-of-compunction",
      "perfervid-haste"
    ],
    "stratagem_ids": [
      "sanctified-blows",
      "faithful-fortitude",
      "unflinching-determination-sacred-champions"
    ],
    "game_version": {
      "edition": "11th",
      "dataslate": "pre-launch-provisional"
    },
    "detachment_points": 1,
    "force_dispositions": [
      "take-and-hold"
    ],
    "tags": [
      "reverend"
    ]
  },
  {
    "id": "sanctified-orators",
    "name": "Sanctified Orators",
    "faction_id": "adepta-sororitas",
    "detachment_rule_id": "hymns-of-battle",
    "enhancement_ids": [
      "hagiomnifex"
    ],
    "stratagem_ids": [],
    "game_version": {
      "edition": "11th",
      "dataslate": "pre-launch-provisional"
    },
    "detachment_points": 1,
    "force_dispositions": [
      "purge-the-foe"
    ]
  }
]
