[
  {
    "id": "augurium-task-force",
    "name": "Augurium Task Force",
    "faction_id": "grey-knights",
    "detachment_rule_id": null,
    "enhancement_ids": [
      "grimoire-of-conjunctions",
      "shield-of-prophecy",
      "one-foot-in-the-future",
      "doomseers-amulet"
    ],
    "stratagem_ids": [
      "aggressive-anticipation",
      "appointed-hour",
      "forewarned-evasion",
      "necessary-end",
      "redirected-strike",
      "mirage-of-echoes"
    ],
    "game_version": {
      "edition": "11th",
      "dataslate": "pre-launch-provisional"
    },
    "detachment_points": 2,
    "force_dispositions": []
  },
  {
    "id": "banishers",
    "name": "Banishers",
    "faction_id": "grey-knights",
    "detachment_rule_id": null,
    "enhancement_ids": [
      "sigil-of-the-hunt",
      "ephemeral-tome",
      "sixty-sixth-seal",
      "pyresoul-psychic"
    ],
    "stratagem_ids": [
      "hexwrought-reprisal",
      "warding-chant",
      "chaos-bane",
      "celerity",
      "circle-of-sanctuary",
      "shadow-of-anarch"
    ],
    "game_version": {
      "edition": "11th",
      "dataslate": "pre-launch-provisional"
    },
    "detachment_points": 2,
    "force_dispositions": []
  },
  {
    "id": "warpbane-task-force",
    "name": "Warpbane Task Force",
    "faction_id": "grey-knights",
    "detachment_rule_id": null,
    "enhancement_ids": [
      "mandulian-reliquary",
      "radiant-champion",
      "phial-of-the-abyss",
      "paragon-of-sanctity"
    ],
    "stratagem_ids": [
      "sanctified-kill-zone",
      "fires-of-covenant",
      "flames-of-sanctity",
      "aegis-eternal",
      "hallowed-beacon",
      "repelling-sphere"
    ],
    "game_version": {
      "edition": "11th",
      "dataslate": "pre-launch-provisional"
    },
    "detachment_points": 3,
    "force_dispositions": []
  },
  {
    "id": "brotherhood-strike",
    "name": "Brotherhood Strike",
    "faction_id": "grey-knights",
    "detachment_rule_id": null,
    "enhancement_ids": [
      "banishing-wave-psychic",
      "blinding-aura",
      "purity-of-purpose",
      "tome-of-forbidden-ways"
    ],
    "stratagem_ids": [
      "purgation-pattern",
      "shining-veil",
      "combat-manifestation",
      "duty-unending",
      "truesilver-channelling",
      "expeditious-exit"
    ],
    "game_version": {
      "edition": "11th",
      "dataslate": "pre-launch-provisional"
    },
    "detachment_points": 2,
    "force_dispositions": []
  },
  {
    "id": "hallowed-conclave",
    "name": "Hallowed Conclave",
    "faction_id": "grey-knights",
    "detachment_rule_id": null,
    "enhancement_ids": [
      "eye-of-the-augurim",
      "inescapable-judgement-psychic",
      "sanctic-reaper",
      "nemesis-rounds"
    ],
    "stratagem_ids": [
      "giants-of-the-battlefield",
      "unending-fidelity",
      "point-blank-purgation",
      "grind-them-underfoot",
      "precognitive-strategies",
      "shining-resolve"
    ],
    "game_version": {
      "edition": "11th",
      "dataslate": "pre-launch-provisional"
    },
    "detachment_points": 2,
    "force_dispositions": []
  },
  {
    "id": "sanctic-spearhead",
    "name": "Sanctic Spearhead",
    "faction_id": "grey-knights",
    "detachment_rule_id": null,
    "enhancement_ids": [
      "driven-by-duty",
      "quickening-foci",
      "sigil-of-exigence",
      "spiritus-machina"
    ],
    "stratagem_ids": [
      "abominus-class-targets",
      "truesilver-will",
      "armoured-aegis",
      "redoubled-assault",
      "force-wave",
      "argent-wrath"
    ],
    "game_version": {
      "edition": "11th",
      "dataslate": "pre-launch-provisional"
    },
    "detachment_points": 2,
    "force_dispositions": []
  },
  {
    "id": "argent-assault",
    "name": "Argent Assault",
    "faction_id": "grey-knights",
    "detachment_rule_id": null,
    "enhancement_ids": [
      "psychic-celerity",
      "vigilance-of-titan"
    ],
    "stratagem_ids": [
      "truesilver-aegis",
      "a-threat-ended",
      "aura-of-vengeance"
    ],
    "game_version": {
      "edition": "11th",
      "dataslate": "pre-launch-provisional"
    },
    "detachment_points": 1,
    "force_dispositions": []
  },
  {
    "id": "fires-of-purgation",
    "name": "Fires of Purgation",
    "faction_id": "grey-knights",
    "detachment_rule_id": null,
    "enhancement_ids": [
      "precognicient-volleys",
      "boons-of-deimos"
    ],
    "stratagem_ids": [
      "soul-locked",
      "focused-immolation",
      "spiritsear"
    ],
    "game_version": {
      "edition": "11th",
      "dataslate": "pre-launch-provisional"
    },
    "detachment_points": 1,
    "force_dispositions": []
  },
  {
    "id": "immaterial-interdiction",
    "name": "Immaterial Interdiction",
    "faction_id": "grey-knights",
    "detachment_rule_id": null,
    "enhancement_ids": [
      "predestined-coordinates",
      "astral-overlap"
    ],
    "stratagem_ids": [
      "blades-from-the-beyond",
      "by-thought-alone",
      "responsive-displacement"
    ],
    "game_version": {
      "edition": "11th",
      "dataslate": "pre-launch-provisional"
    },
    "detachment_points": 1,
    "force_dispositions": []
  }
]
