[
  {
    "id": "inner-circle-task-force",
    "name": "Inner Circle Task Force",
    "faction_id": "dark-angels",
    "detachment_rule_id": null,
    "enhancement_ids": [
      "champion-of-the-deathwing",
      "eye-of-the-unseen",
      "singular-will",
      "deathwing-assault"
    ],
    "stratagem_ids": [
      "unmatched-fortitude",
      "armour-of-contempt",
      "wrath-of-the-lion",
      "martial-mastery",
      "relic-teleportarium",
      "duty-unto-death"
    ],
    "game_version": {
      "edition": "11th",
      "dataslate": "pre-launch-provisional"
    },
    "detachment_points": 2,
    "force_dispositions": [
      "priority-assets"
    ]
  },
  {
    "id": "unforgiven-task-force",
    "name": "Unforgiven Task Force",
    "faction_id": "dark-angels",
    "detachment_rule_id": null,
    "enhancement_ids": [
      "shroud-of-heroes",
      "stubborn-tenacity",
      "weapons-of-the-first-legion",
      "pennant-of-remembrance"
    ],
    "stratagem_ids": [
      "armour-of-contempt",
      "unforgiven-fury",
      "fire-discipline",
      "unbreakable-lines",
      "intractable",
      "grim-retribution"
    ],
    "game_version": {
      "edition": "11th",
      "dataslate": "pre-launch-provisional"
    },
    "detachment_points": 2,
    "force_dispositions": []
  },
  {
    "id": "lions-blade-task-force",
    "name": "Lion’s Blade Task Force",
    "faction_id": "dark-angels",
    "detachment_rule_id": null,
    "enhancement_ids": [
      "calibanite-armaments",
      "lord-of-the-hunt",
      "stalwart-champion",
      "fulgus-magna"
    ],
    "stratagem_ids": [
      "overpowering-exaction",
      "knights-of-iron",
      "illuminating-fire",
      "armour-of-contempt",
      "inescapable-wrath",
      "strength-in-unity"
    ],
    "game_version": {
      "edition": "11th",
      "dataslate": "pre-launch-provisional"
    },
    "detachment_points": 2,
    "force_dispositions": [
      "purge-the-foe"
    ]
  },
  {
    "id": "wrath-of-the-rock",
    "name": "Wrath of the Rock",
    "faction_id": "dark-angels",
    "detachment_rule_id": null,
    "enhancement_ids": [
      "tempered-in-battle-aura",
      "ancient-weapons",
      "deathwing-assault",
      "lord-of-the-ravenwing"
    ],
    "stratagem_ids": [
      "inescapable-justice",
      "tactical-mastery",
      "lions-will",
      "relics-of-the-dark-age",
      "leonine-aggression",
      "armour-of-contempt"
    ],
    "game_version": {
      "edition": "11th",
      "dataslate": "pre-launch-provisional"
    },
    "detachment_points": 3,
    "force_dispositions": [
      "priority-assets"
    ]
  },
  {
    "id": "dark-age-arsenal",
    "name": "Dark Age Arsenal",
    "faction_id": "dark-angels",
    "detachment_rule_id": null,
    "enhancement_ids": [
      "petition-of-stability",
      "entreaty-of-perpetual-ardour"
    ],
    "stratagem_ids": [
      "searing-bursts",
      "no-sacrifice-too-great",
      "revelation-of-guilt"
    ],
    "game_version": {
      "edition": "11th",
      "dataslate": "pre-launch-provisional"
    },
    "detachment_points": 1,
    "force_dispositions": [
      "priority-assets"
    ]
  },
  {
    "id": "darkflight-pursuit",
    "name": "Darkflight Pursuit",
    "faction_id": "dark-angels",
    "detachment_rule_id": null,
    "enhancement_ids": [
      "thundercowl-turbines",
      "nightforged-battery"
    ],
    "stratagem_ids": [
      "skyborne-surveillance",
      "wings-of-shadow",
      "we-are-vengeance"
    ],
    "game_version": {
      "edition": "11th",
      "dataslate": "pre-launch-provisional"
    },
    "detachment_points": 1,
    "force_dispositions": []
  },
  {
    "id": "interrogation-conclave",
    "name": "Interrogation Conclave",
    "faction_id": "dark-angels",
    "detachment_rule_id": null,
    "enhancement_ids": [
      "limitless-zeal",
      "inescapable-interrogation"
    ],
    "stratagem_ids": [
      "exacting-punishment",
      "terrifying-zeal",
      "wages-of-cowardice"
    ],
    "game_version": {
      "edition": "11th",
      "dataslate": "pre-launch-provisional"
    },
    "detachment_points": 1,
    "force_dispositions": [
      "purge-the-foe"
    ]
  },
  {
    "id": "company-of-hunters",
    "name": "Company of Hunters",
    "faction_id": "dark-angels",
    "detachment_rule_id": null,
    "enhancement_ids": [
      "master-crafted-weapon",
      "mounted-strategist",
      "master-of-manoeuvre",
      "recon-hunter"
    ],
    "stratagem_ids": [
      "armour-of-contempt",
      "death-on-the-wind",
      "high-speed-focus",
      "rapid-reappraisal",
      "hunters-trail",
      "talon-strike"
    ],
    "game_version": {
      "edition": "11th",
      "dataslate": "pre-launch-provisional"
    },
    "detachment_points": 2,
    "force_dispositions": [
      "disruption"
    ]
  }
]
