[
  {
    "id": "imperialis-fleet",
    "name": "Imperialis Fleet",
    "faction_id": "agents-of-the-imperium",
    "detachment_rule_id": null,
    "enhancement_ids": [
      "digital-weapons",
      "clandestine-operation",
      "fleetmaster",
      "combat-landers"
    ],
    "stratagem_ids": [
      "close-quarters-barrage",
      "masters-of-the-void",
      "selfless-bodyguard",
      "emperors-will",
      "violent-acquisition",
      "displacer-field"
    ],
    "game_version": {
      "edition": "11th",
      "dataslate": "pre-launch-provisional"
    },
    "detachment_points": 3,
    "force_dispositions": [
      "disruption"
    ]
  },
  {
    "id": "ordo-hereticus-purgation-force",
    "name": "Ordo Hereticus, Purgation Force",
    "faction_id": "agents-of-the-imperium",
    "detachment_rule_id": null,
    "enhancement_ids": [
      "liber-heresius",
      "no-escape-aura",
      "witch-hunter",
      "ignis-judicium"
    ],
    "stratagem_ids": [
      "dispense-justice",
      "execution-order",
      "line-of-fire",
      "exact-punishment",
      "inviolate-jurisdiction",
      "stun-grenades"
    ],
    "game_version": {
      "edition": "11th",
      "dataslate": "pre-launch-provisional"
    },
    "detachment_points": 3,
    "force_dispositions": [
      "priority-assets"
    ]
  },
  {
    "id": "veiled-blade-elimination-force",
    "name": "Veiled Blade Elimination Force",
    "faction_id": "agents-of-the-imperium",
    "detachment_rule_id": null,
    "enhancement_ids": [],
    "stratagem_ids": [
      "prime-target",
      "hyperstimms",
      "will-sapping-salvo",
      "orbital-oversight",
      "blind-grenades",
      "ensnaring-trap"
    ],
    "game_version": {
      "edition": "11th",
      "dataslate": "pre-launch-provisional"
    },
    "detachment_points": 3,
    "force_dispositions": [
      "purge-the-foe"
    ]
  },
  {
    "id": "ordo-xenos-alien-hunters",
    "name": "Ordo Xenos, Alien Hunters",
    "faction_id": "agents-of-the-imperium",
    "detachment_rule_id": null,
    "enhancement_ids": [
      "universal-anathema",
      "blackweave-shroud",
      "beacon-angelis",
      "amulet-of-auto-chastisement"
    ],
    "stratagem_ids": [
      "armour-of-contempt",
      "adaptive-tactics",
      "rapid-tactical-relocation",
      "hellfire-rounds",
      "dragonfire-rounds",
      "kraken-rounds"
    ],
    "game_version": {
      "edition": "11th",
      "dataslate": "pre-launch-provisional"
    },
    "detachment_points": 3,
    "force_dispositions": [
      "purge-the-foe"
    ]
  },
  {
    "id": "ordo-malleus-daemon-hunters",
    "name": "Ordo Malleus, Daemon Hunters",
    "faction_id": "agents-of-the-imperium",
    "detachment_rule_id": null,
    "enhancement_ids": [
      "formidable-resolve",
      "daemon-slayer",
      "grimoire-of-true-names-aura",
      "gift-of-the-prescient"
    ],
    "stratagem_ids": [
      "ritual-of-warding",
      "rites-of-exorcism",
      "steel-heart",
      "truesilver-armour",
      "hexagrammic-wards",
      "psybolt-ammunition"
    ],
    "game_version": {
      "edition": "11th",
      "dataslate": "pre-launch-provisional"
    },
    "detachment_points": 3,
    "force_dispositions": [
      "reconnaissance"
    ]
  }
]
