[
  {
    "id": "recon-element",
    "name": "Recon Element",
    "faction_id": "astra-militarum",
    "detachment_rule_id": null,
    "enhancement_ids": [
      "guerrilla-honours",
      "scare-gas-grenades",
      "survival-gear",
      "tripwires"
    ],
    "stratagem_ids": [
      "crack-shots",
      "scouting-outriders",
      "draw-them-out",
      "courageous-diversion",
      "scramble-field",
      "tanglefoot-grenades"
    ],
    "game_version": {
      "edition": "11th",
      "dataslate": "pre-launch-provisional"
    },
    "detachment_points": 3,
    "force_dispositions": [
      "reconnaissance"
    ],
    "tags": [
      "recon"
    ]
  },
  {
    "id": "hammer-of-the-emperor",
    "name": "Hammer of the Emperor",
    "faction_id": "astra-militarum",
    "detachment_rule_id": null,
    "enhancement_ids": [
      "calm-under-fire",
      "indomitable-steed",
      "regimental-banner",
      "veteran-crew"
    ],
    "stratagem_ids": [
      "blazing-advance",
      "furious-cannonade",
      "final-hour",
      "tactical-withdrawal",
      "crash-through",
      "ablative-plating"
    ],
    "game_version": {
      "edition": "11th",
      "dataslate": "pre-launch-provisional"
    },
    "detachment_points": 2,
    "force_dispositions": [
      "purge-the-foe"
    ]
  },
  {
    "id": "combined-arms",
    "name": "Combined Arms",
    "faction_id": "astra-militarum",
    "detachment_rule_id": null,
    "enhancement_ids": [
      "death-mask-of-ollanius",
      "drill-commander",
      "grand-strategist",
      "reactive-command"
    ],
    "stratagem_ids": [
      "coordinated-action",
      "fields-of-fire",
      "stalwart-protector",
      "inspired-command",
      "reinforcements",
      "flexible-command"
    ],
    "game_version": {
      "edition": "11th",
      "dataslate": "pre-launch-provisional"
    },
    "detachment_points": 3,
    "force_dispositions": [
      "take-and-hold"
    ]
  },
  {
    "id": "grizzled-company",
    "name": "Grizzled Company",
    "faction_id": "astra-militarum",
    "detachment_rule_id": null,
    "enhancement_ids": [
      "abhuman-detail",
      "aquilan-eye",
      "spec-ops-veteran",
      "laud-hailer"
    ],
    "stratagem_ids": [
      "veteran-sharpshooters",
      "purging-fire",
      "mordian-minute",
      "additional-armour",
      "snap-to-it",
      "no-retreat"
    ],
    "game_version": {
      "edition": "11th",
      "dataslate": "pre-launch-provisional"
    },
    "detachment_points": 3,
    "force_dispositions": [
      "priority-assets"
    ]
  },
  {
    "id": "bridgehead-strike",
    "name": "Bridgehead Strike",
    "faction_id": "astra-militarum",
    "detachment_rule_id": "fire-zone-purge",
    "enhancement_ids": [
      "bombast-class-vox-array",
      "priority-drop-beacon"
    ],
    "stratagem_ids": [
      "on-my-position",
      "firing-hot",
      "servo-designators"
    ],
    "game_version": {
      "edition": "11th",
      "dataslate": "pre-launch-provisional"
    },
    "detachment_points": 1,
    "force_dispositions": [
      "priority-assets"
    ]
  },
  {
    "id": "mechanised-assault",
    "name": "Mechanised Assault",
    "faction_id": "astra-militarum",
    "detachment_rule_id": null,
    "enhancement_ids": [
      "bold-leadership",
      "sacred-unguents",
      "smoke-grenades",
      "vanguard-honours"
    ],
    "stratagem_ids": [
      "clear-and-secure",
      "swift-interception",
      "hasty-extraction",
      "rapid-dispersal",
      "move-out",
      "vox-relay"
    ],
    "game_version": {
      "edition": "11th",
      "dataslate": "pre-launch-provisional"
    },
    "detachment_points": 2,
    "force_dispositions": [
      "purge-the-foe"
    ]
  },
  {
    "id": "siege-regiment",
    "name": "Siege Regiment",
    "faction_id": "astra-militarum",
    "detachment_rule_id": null,
    "enhancement_ids": [
      "eager-advance",
      "flash-grenades",
      "legacy-sidearm",
      "stalwarts-honours"
    ],
    "stratagem_ids": [
      "callous-sacrifice",
      "trench-fighters",
      "furious-fusillade",
      "over-the-top",
      "minefield",
      "flare-burst"
    ],
    "game_version": {
      "edition": "11th",
      "dataslate": "pre-launch-provisional"
    },
    "detachment_points": 2,
    "force_dispositions": [
      "disruption"
    ]
  },
  {
    "id": "abhuman-auxiliaries",
    "name": "Abhuman Auxiliaries",
    "faction_id": "astra-militarum",
    "detachment_rule_id": "absolutist-principles",
    "enhancement_ids": [
      "sharp-eyes-light-fingers",
      "exemplar-of-duty"
    ],
    "stratagem_ids": [
      "thick-skulled-obdurance",
      "low-profile",
      "stirred-to-action"
    ],
    "game_version": {
      "edition": "11th",
      "dataslate": "pre-launch-provisional"
    },
    "detachment_points": 1,
    "force_dispositions": [
      "take-and-hold"
    ],
    "tags": [
      "abhuman"
    ]
  },
  {
    "id": "designation-force",
    "name": "Designation Force",
    "faction_id": "astra-militarum",
    "detachment_rule_id": "designated-targets",
    "enhancement_ids": [
      "long-range-scout",
      "recon-star"
    ],
    "stratagem_ids": [
      "close-range-detection",
      "triggered-alerts",
      "sump-smog-screen"
    ],
    "game_version": {
      "edition": "11th",
      "dataslate": "pre-launch-provisional"
    },
    "detachment_points": 1,
    "force_dispositions": [
      "reconnaissance"
    ],
    "tags": [
      "recon"
    ]
  },
  {
    "id": "steel-hammer",
    "name": "Steel Hammer",
    "faction_id": "astra-militarum",
    "detachment_rule_id": "ceaseless-cannonade",
    "enhancement_ids": [
      "battalion-commander",
      "titan-killer-steel-hammer",
      "engine-speaker",
      "assault-hatches"
    ],
    "stratagem_ids": [
      "engine-of-wrath",
      "shattering-salvo",
      "imposing-arrival",
      "withering-firepower",
      "adamantine-behemoth",
      "accuracy-under-pressure"
    ],
    "game_version": {
      "edition": "11th",
      "dataslate": "pre-launch-provisional"
    },
    "detachment_points": 2,
    "force_dispositions": [
      "purge-the-foe"
    ]
  },
  {
    "id": "armoured-infantry",
    "name": "Armoured Infantry",
    "faction_id": "astra-militarum",
    "detachment_rule_id": "squadron-command",
    "enhancement_ids": [
      "exemplary-officer",
      "master-manoeuvrist",
      "omnissian-unguents",
      "grand-strategist-armoured-infantry"
    ],
    "stratagem_ids": [
      "order-the-advance",
      "supporting-ordnance",
      "mobile-firebase",
      "combined-fire",
      "burst-of-speed",
      "opening-salvo"
    ],
    "game_version": {
      "edition": "11th",
      "dataslate": "pre-launch-provisional"
    },
    "detachment_points": 2,
    "force_dispositions": [
      "take-and-hold"
    ],
    "granted_keywords": [
      {
        "keyword": "Armoured Skirmisher",
        "to_keywords": [
          "Astra Militarum Squadron"
        ]
      }
    ]
  }
]
