[
  {
    "id": "the-lost-brethren",
    "name": "The Lost Brethren",
    "faction_id": "blood-angels",
    "detachment_rule_id": null,
    "enhancement_ids": [
      "sanguinius-grace",
      "blood-shard",
      "to-slay-the-warmaster",
      "vengeful-onslaught"
    ],
    "stratagem_ids": [
      "armour-of-contempt",
      "furious-onslaught",
      "lost-to-rage",
      "glorious-sacrifice",
      "final-retribution",
      "wrathful-rampage"
    ],
    "game_version": {
      "edition": "11th",
      "dataslate": "pre-launch-provisional"
    },
    "detachment_points": 2,
    "force_dispositions": []
  },
  {
    "id": "angelic-inheritors",
    "name": "Angelic Inheritors",
    "faction_id": "blood-angels",
    "detachment_rule_id": null,
    "enhancement_ids": [
      "prescient-flash",
      "troubling-visions",
      "blazing-icon",
      "ordained-sacrifice"
    ],
    "stratagem_ids": [
      "armour-of-contempt",
      "strike-now-for-glory",
      "focused-fury",
      "in-the-shadow-of-great-wings",
      "unto-the-burning-skies",
      "instant-of-grace"
    ],
    "game_version": {
      "edition": "11th",
      "dataslate": "pre-launch-provisional"
    },
    "detachment_points": 3,
    "force_dispositions": [
      "priority-assets"
    ]
  },
  {
    "id": "the-angelic-host",
    "name": "The Angelic Host",
    "faction_id": "blood-angels",
    "detachment_rule_id": null,
    "enhancement_ids": [
      "artisan-of-war",
      "visage-of-death",
      "archangels-shard",
      "gleaming-pinions"
    ],
    "stratagem_ids": [
      "armour-of-contempt",
      "angels-sacrifice",
      "martial-examplars",
      "unbridled-ardour",
      "descent-of-angels",
      "death-from-the-skies"
    ],
    "game_version": {
      "edition": "11th",
      "dataslate": "pre-launch-provisional"
    },
    "detachment_points": 2,
    "force_dispositions": []
  },
  {
    "id": "rage-cursed-onslaught",
    "name": "Rage-cursed Onslaught",
    "faction_id": "blood-angels",
    "detachment_rule_id": null,
    "enhancement_ids": [
      "carmine-reliquary",
      "master-of-the-red-thirst",
      "sanguinary-tear-aura",
      "angels-fang"
    ],
    "stratagem_ids": [
      "a-grim-warning",
      "limb-from-limb",
      "armour-of-contempt",
      "deathless-duty",
      "insensate-rampage",
      "red-wrath"
    ],
    "game_version": {
      "edition": "11th",
      "dataslate": "pre-launch-provisional"
    },
    "detachment_points": 3,
    "force_dispositions": [
      "purge-the-foe"
    ]
  },
  {
    "id": "encarmine-speartip",
    "name": "Encarmine Speartip",
    "faction_id": "blood-angels",
    "detachment_rule_id": null,
    "enhancement_ids": [
      "angelic-executioner",
      "shadow-of-abomination"
    ],
    "stratagem_ids": [
      "inexorable-valour",
      "judgement-of-the-golden-host",
      "blinding-blurs-of-vengeance"
    ],
    "game_version": {
      "edition": "11th",
      "dataslate": "pre-launch-provisional"
    },
    "detachment_points": 1,
    "force_dispositions": []
  },
  {
    "id": "legacy-of-grace",
    "name": "Legacy of Grace",
    "faction_id": "blood-angels",
    "detachment_rule_id": null,
    "enhancement_ids": [
      "blood-boil",
      "aureole-of-the-angel"
    ],
    "stratagem_ids": [
      "martial-paragon",
      "aura-of-the-angels-grace"
    ],
    "game_version": {
      "edition": "11th",
      "dataslate": "pre-launch-provisional"
    },
    "detachment_points": 1,
    "force_dispositions": []
  },
  {
    "id": "wrath-of-the-doomed",
    "name": "Wrath of the Doomed",
    "faction_id": "blood-angels",
    "detachment_rule_id": null,
    "enhancement_ids": [
      "instinctive-interception"
    ],
    "stratagem_ids": [
      "no-barrier-to-retribution",
      "death-begets-vengeance"
    ],
    "game_version": {
      "edition": "11th",
      "dataslate": "pre-launch-provisional"
    },
    "detachment_points": 1,
    "force_dispositions": [
      "purge-the-foe"
    ]
  },
  {
    "id": "liberator-assault-group",
    "name": "Liberator Assault Group",
    "faction_id": "blood-angels",
    "detachment_rule_id": null,
    "enhancement_ids": [
      "speed-of-the-primarch",
      "rage-fuelled-warrior",
      "icon-of-the-angel",
      "gift-of-foresight"
    ],
    "stratagem_ids": [
      "armour-of-contempt",
      "savage-echoes",
      "red-rampage",
      "angelic-grace",
      "aggressive-onslaught",
      "relentless-assault"
    ],
    "game_version": {
      "edition": "11th",
      "dataslate": "pre-launch-provisional"
    },
    "detachment_points": 3,
    "force_dispositions": [
      "take-and-hold"
    ]
  }
]
